key,title,stage,topic,method,difficulty,omitted_count,omitted_steps,structural_sentence,common_slip
subset-chain,Subset chain,proof fluency,sets,direct,1,1,arbitrary-object,Choose one arbitrary element from the first set and walk it through both inclusions.,Starting from x ∈ B or x ∈ C skips the only structural move that matters.
divisibility-sum,Divisibility under addition,proof fluency,integers,direct,2,2,witness-or-coefficients; algebra-or-components,"Name the two divisibility witnesses first, then recombine them into one new witness.",Saying “both have a factor a” is not yet a proof unless one witness for b + c is written down.
kernel-subspace,Kernel is a subspace,linear algebra bridge,linear maps,subspace proof,3,3,arbitrary-object; closure-or-split; close-the-claim,"The subspace proof is not one sentence. It is zero vector, additivity, and scalar closure in that order.","Writing “kernels are always subspaces” is a memory cue, not the proof."
square-zero-image-kernel,T² = 0 forces Im(T) ⊆ Ker(T),linear algebra bridge,linear maps,direct,3,3,arbitrary-object; witness-or-coefficients; close-the-claim,"To prove image inside kernel, start from an arbitrary image element and expose the hidden preimage.","If the hidden preimage never appears, the proof cannot use the hypothesis T² = 0 in the right place."
independent-extension,Adjoining a vector outside the span,linear algebra bridge,independence,contradiction / linear combination,4,3,witness-or-coefficients; contradiction-pivot; close-the-claim,"The key pivot is to force v into the old span if the new coefficient is nonzero, then contradict the hypothesis.",Using the old independence too early misses the actual reason the new vector is safe to adjoin.
rotation-no-real-line,A real rotation has no nonzero invariant line,geometry follow-up,invariant subspaces,contradiction / components,5,4,arbitrary-object; algebra-or-components; contradiction-pivot; close-the-claim,"Turn “invariant line” back into coordinates: if Ru stayed on the same real line, one real scalar λ would have to fit both rotated coordinates at once.","Pointing at a picture of a rotated arrow is good intuition, but it is not yet the contradiction."
